{
  "boundaries": [
    {
      "id": "command",
      "owner": "stream_config_coordinator",
      "registryOrdinal": 1
    },
    {
      "id": "next_stream",
      "owner": "stream_config_coordinator",
      "registryOrdinal": 2
    },
    {
      "id": "next_plan_or_manual",
      "owner": "narrative_actor",
      "registryOrdinal": 3
    },
    {
      "id": "next_beat_plan",
      "owner": "narrative_actor",
      "registryOrdinal": 4
    },
    {
      "id": "next_director_pass",
      "owner": "narrative_actor",
      "registryOrdinal": 5
    },
    {
      "id": "next_silence_deadline",
      "owner": "narrative_actor",
      "registryOrdinal": 6
    },
    {
      "id": "next_request",
      "owner": "narrative_actor",
      "registryOrdinal": 7
    },
    {
      "id": "next_utterance",
      "owner": "narrative_actor",
      "registryOrdinal": 8
    },
    {
      "id": "next_cancellation",
      "owner": "narrative_actor",
      "registryOrdinal": 9
    },
    {
      "id": "next_record",
      "owner": "tape_writer",
      "registryOrdinal": 10
    },
    {
      "id": "next_rotated_file",
      "owner": "tape_writer",
      "registryOrdinal": 11
    },
    {
      "id": "next_rotation",
      "owner": "tape_writer",
      "registryOrdinal": 12
    },
    {
      "id": "next_writer_deadline",
      "owner": "tape_writer",
      "registryOrdinal": 13
    },
    {
      "id": "next_shutdown",
      "owner": "composition_root",
      "registryOrdinal": 14
    }
  ],
  "contractProjectionVersion": 1,
  "crossFieldInvariants": [
    "active_episode_capacity_lte_resolved_episode_capacity",
    "tape_channels_nonempty_when_enabled",
    "full_prompt_requires_llm_eval_channel",
    "output_path_not_filesystem_home_or_repository_root",
    "detector_overrides_resolve_exported_contract",
    "required_tuning_detector_requires_calibration_capture_preflight"
  ],
  "defaultConfig": {
    "commentary.detectors.profile": "production",
    "commentary.director.active_episode_capacity": 64,
    "commentary.director.decision_capacity": 128,
    "commentary.director.global_min_interval_s": 4.0,
    "commentary.director.long_silence_s": 33.0,
    "commentary.director.max_consecutive_story_beats": 3,
    "commentary.director.opportunity_capacity": 128,
    "commentary.director.resolved_episode_capacity": 256,
    "commentary.director.selection_threshold": 35.0,
    "commentary.director.switch_margin": 8.0,
    "commentary.driver_name": "",
    "commentary.driver_nickname": "",
    "commentary.enabled": false,
    "commentary.llm.base_url": "http://127.0.0.1:11434/v1",
    "commentary.llm.enabled": false,
    "commentary.llm.max_profile": "tight",
    "commentary.llm.max_tokens": 96,
    "commentary.llm.model": "qwen3:4b-instruct-2507-q4_K_M",
    "commentary.llm.timeout_s": 1.5,
    "commentary.llm.warmup": true,
    "commentary.max_utterance_s": 14.0,
    "commentary.tape.channels": [
      "flow"
    ],
    "commentary.tape.compress_rotated": true,
    "commentary.tape.detail": "normal",
    "commentary.tape.detector_tuning.capture_input_windows": true,
    "commentary.tape.detector_tuning.near_threshold_margin": 0.15,
    "commentary.tape.detector_tuning.negative_sample_interval_s": 5.0,
    "commentary.tape.detector_tuning.trigger_allowlist": [],
    "commentary.tape.enabled": false,
    "commentary.tape.flow.candidate_detail": "selected_and_rejected",
    "commentary.tape.flow.tape_channel_allowlist": [
      "*"
    ],
    "commentary.tape.flush_interval_ms": 500,
    "commentary.tape.keep_files": 8,
    "commentary.tape.llm_eval.capture_completion": true,
    "commentary.tape.llm_eval.capture_prompt": "hash",
    "commentary.tape.output_dir": "recordings/commentary",
    "commentary.tape.rotate_mb": 64,
    "commentary.tape.shutdown_flush_timeout_s": 2.0,
    "commentary.tape.writer_capacity": 4096,
    "commentary.tone_source": "none",
    "commentary.tts.audio_device": "",
    "commentary.tts.backend": "auto",
    "commentary.tts.duck_fade_ms": 750,
    "commentary.tts.duck_input": "",
    "commentary.tts.duck_ratio": 0.25,
    "commentary.tts.rate": 0,
    "commentary.tts.start_timeout_s": 5.0,
    "commentary.tts.steps": 6,
    "commentary.tts.stop_timeout_s": 1.0,
    "commentary.tts.voice": "",
    "commentary.llm.provider": "local",
    "commentary.llm.mode": "live",
    "commentary.llm.api_key_env": "IRSWITCH_LLM_API_KEY",
    "commentary.llm.wording_policy": "strict"
  },
  "keyDefinitions": [
    {
      "applyBoundary": "command",
      "boundaryNote": null,
      "boundaryOwner": "stream_config_coordinator",
      "constraints": {
        "normativeAllowed": "bool"
      },
      "default": false,
      "defaultSource": "literal",
      "key": "commentary.enabled",
      "keyClass": "static",
      "preflightComponent": null,
      "sensitive": false,
      "unit": null,
      "valueType": "boolean"
    },
    {
      "applyBoundary": "next_plan_or_manual",
      "boundaryNote": null,
      "boundaryOwner": "narrative_actor",
      "constraints": {
        "maximum": 30.0,
        "minimum": 2.0,
        "normativeAllowed": "2–30"
      },
      "default": 14.0,
      "defaultSource": "literal",
      "key": "commentary.max_utterance_s",
      "keyClass": "static",
      "preflightComponent": null,
      "sensitive": false,
      "unit": "seconds",
      "valueType": "number"
    },
    {
      "applyBoundary": "next_stream",
      "boundaryNote": null,
      "boundaryOwner": "stream_config_coordinator",
      "constraints": {
        "maxLength": 128,
        "minLength": 0,
        "normativeAllowed": "0–128 UTF-8 chars"
      },
      "default": "",
      "defaultSource": "literal",
      "key": "commentary.driver_name",
      "keyClass": "static",
      "preflightComponent": null,
      "sensitive": true,
      "unit": null,
      "valueType": "string"
    },
    {
      "applyBoundary": "next_stream",
      "boundaryNote": null,
      "boundaryOwner": "stream_config_coordinator",
      "constraints": {
        "maxLength": 64,
        "minLength": 0,
        "normativeAllowed": "0–64 UTF-8 chars"
      },
      "default": "",
      "defaultSource": "literal",
      "key": "commentary.driver_nickname",
      "keyClass": "static",
      "preflightComponent": null,
      "sensitive": true,
      "unit": null,
      "valueType": "string"
    },
    {
      "applyBoundary": "next_beat_plan",
      "boundaryNote": null,
      "boundaryOwner": "narrative_actor",
      "constraints": {
        "normativeAllowed": "none, heart_rate",
        "values": [
          "none",
          "heart_rate"
        ]
      },
      "default": "none",
      "defaultSource": "literal",
      "key": "commentary.tone_source",
      "keyClass": "static",
      "preflightComponent": null,
      "sensitive": false,
      "unit": null,
      "valueType": "enum"
    },
    {
      "applyBoundary": "next_director_pass",
      "boundaryNote": null,
      "boundaryOwner": "narrative_actor",
      "constraints": {
        "maximum": 100.0,
        "minimum": 0.0,
        "normativeAllowed": "0–100"
      },
      "default": 35.0,
      "defaultSource": "literal",
      "key": "commentary.director.selection_threshold",
      "keyClass": "static",
      "preflightComponent": null,
      "sensitive": false,
      "unit": "score",
      "valueType": "number"
    },
    {
      "applyBoundary": "next_director_pass",
      "boundaryNote": null,
      "boundaryOwner": "narrative_actor",
      "constraints": {
        "maximum": 50.0,
        "minimum": 0.0,
        "normativeAllowed": "0–50"
      },
      "default": 8.0,
      "defaultSource": "literal",
      "key": "commentary.director.switch_margin",
      "keyClass": "static",
      "preflightComponent": null,
      "sensitive": false,
      "unit": "score",
      "valueType": "number"
    },
    {
      "applyBoundary": "next_director_pass",
      "boundaryNote": null,
      "boundaryOwner": "narrative_actor",
      "constraints": {
        "maximum": 30.0,
        "minimum": 0.0,
        "normativeAllowed": "0–30"
      },
      "default": 4.0,
      "defaultSource": "literal",
      "key": "commentary.director.global_min_interval_s",
      "keyClass": "static",
      "preflightComponent": null,
      "sensitive": false,
      "unit": "seconds",
      "valueType": "number"
    },
    {
      "applyBoundary": "next_silence_deadline",
      "boundaryNote": null,
      "boundaryOwner": "narrative_actor",
      "constraints": {
        "maximum": 300.0,
        "minimum": 10.0,
        "normativeAllowed": "10–300"
      },
      "default": 33.0,
      "defaultSource": "literal",
      "key": "commentary.director.long_silence_s",
      "keyClass": "static",
      "preflightComponent": null,
      "sensitive": false,
      "unit": "seconds",
      "valueType": "number"
    },
    {
      "applyBoundary": "next_stream",
      "boundaryNote": null,
      "boundaryOwner": "stream_config_coordinator",
      "constraints": {
        "maximum": 512,
        "minimum": 16,
        "normativeAllowed": "16–512"
      },
      "default": 128,
      "defaultSource": "literal",
      "key": "commentary.director.opportunity_capacity",
      "keyClass": "static",
      "preflightComponent": null,
      "sensitive": false,
      "unit": "opportunities",
      "valueType": "integer"
    },
    {
      "applyBoundary": "next_stream",
      "boundaryNote": null,
      "boundaryOwner": "stream_config_coordinator",
      "constraints": {
        "maximum": 256,
        "minimum": 8,
        "normativeAllowed": "8–256"
      },
      "default": 64,
      "defaultSource": "literal",
      "key": "commentary.director.active_episode_capacity",
      "keyClass": "static",
      "preflightComponent": null,
      "sensitive": false,
      "unit": "episodes",
      "valueType": "integer"
    },
    {
      "applyBoundary": "next_stream",
      "boundaryNote": null,